id,taxonomy_id,term_uri,facet,label,definition,parent_id,data,created_at,updated_at,deleted_at
500d4f49-cdda-4973-8427-8be07450ecde,f1bfbae2-3b2f-42b8-8b02-747ee1504399,SS050000,focusArea,Youth development,"Recreational, socialization, enrichment, cultural, entertainment, and developmental activities for children and youth, sometimes offered through youth-oriented clubs, teen centers, or safe spaces. Use this term for general purpose youth centers and clubs, like Police Athletic Leagues. Also includes programs that work to build character and develop leadership and social skills among children and youth. Does not include education related services, such as dropout programs, remedial education, etc. (see Education); or social service programs for families (see Family services) and custodial care services for children and youth (see Supportive housing). Other specific types of services, institutions such as job training and placement programs, sports, recreation programs, etc., should be classified under the category that describes their service focus; e.g., for jobs programs for youth, use Job services or Employment. For organizations that primarily provide human services for kids, use Child welfare.",08f90583-23d5-475d-a6ac-6fd56e5412e7,,2025-07-16 13:03:31.072312+00,2025-07-16 13:03:31.072312+00,
51dfc48a-fdc0-4c60-8afd-386f4b8015ce,f1bfbae2-3b2f-42b8-8b02-747ee1504399,SG050000,focusArea,Political science,"The systematic study of political institutions and behavior. Includes political philosophy, political theory, comparative government and politics, political parties and interest groups, public opinion, political research methods, studies of the government and politics of specific countries, and studies of specific political institutions and processes.",5919c2ab-be9e-48af-9e81-67758223453a,,2025-07-16 13:03:31.072312+00,2025-07-16 13:03:31.072312+00,
5236ca36-751f-47e0-bc12-a7eb0641f0b9,f1bfbae2-3b2f-42b8-8b02-747ee1504399,SE140000,focusArea,Medical specialties,"Projects that include or represent physicians who have special training and expertise in one clinical area of practice which focuses on a specific age group (e.g., geriatrics, pediatrics), an organ system of the body (e.g., internal medicine, obstetrics/gynecology) or complex scientific techniques developed to diagnose or treat certain types of disorders (e.g., nuclear medicine, radiology). Use this term for projects that represent a wide variety of medical disciplines or those that are not broken out at a lower level. These may include: Aerospace medicine; Family practice (care for entire family unit); Nuclear medicine (therapeutic utilization of nuclear materials); Occupational medicine (occupational disease and injury); and Rheumatology (joints, muscles, bones and tendons).",890b4e78-ed3a-4b30-8075-2a0ae8097499,,2025-07-16 13:03:31.072312+00,2025-07-16 13:03:31.072312+00,
5369b612-8136-4474-9a3a-728c2b227e43,d81c255a-7e12-436a-bb52-a52eb592b770,candid:PF100000,POPULATION,Interfaith groups,"Groups of people who represent a variety of beliefs, faiths, and religions and who support and promote positive, cooperative interactions and dialogue. This cooperation can be in the service of greater understanding and a stronger bond between the groups, or to pursue a concrete and cooperative purpose of any other sort.",e9f9c588-52c8-4c7d-b4aa-c6c6f38d3201,,2025-06-04 20:48:18.351649+00,2025-06-04 20:48:18.351649+00,
5467aefa-5be5-4929-b2c8-fc58f2ecb703,f1bfbae2-3b2f-42b8-8b02-747ee1504399,SR040000,focusArea,Antidiscrimination,"Work for the passage and enforcement of laws or other social measures that will more effectively protect the rights of specific groups within the community and/or which utilize a variety of other methods including research, public education and direct services to achieve these ends; and protect civil rights which protect all citizens from discrimination based on race, color, religion, sex or national origin in the areas of voting, education, employment and housing. Use this term for programs that broadly address civil rights and advocacy issues, which focus on populations in multiple categories or which focus on populations not broken out at a lower level. See aso: Diversity and intergroup relations (in International human rights).",05fb0adf-3e44-460b-a2eb-24c7600e2639,,2025-07-16 13:03:31.072312+00,2025-07-16 13:03:31.072312+00,
54e27a5d-f854-4f9d-8b5c-4ad196f77885,f1bfbae2-3b2f-42b8-8b02-747ee1504399,SE020000,focusArea,Health care access,"The ready availability of affordable, quality health and medical care, especially for those in remote areas (rural areas, Indian/Native American reservations, underserved urban areas and other locations without adequate health care services), those with language barriers (culturally sensitive health care) and those who cannot afford to pay for adequate care. Includes efforts to address disparities in life expectancy; quality of life, rates of disease, disability and death; severity of disease; and access to treatment due to an individual's social position or other socially determined circumstances. Use for: Health care parity; Health equity; Right to health care; Patient access; Health care expansion; Culturally sensitive health care.",890b4e78-ed3a-4b30-8075-2a0ae8097499,,2025-07-16 13:03:31.072312+00,2025-07-16 13:03:31.072312+00,
55b1af6b-4594-4cd0-8437-490a5c536713,d81c255a-7e12-436a-bb52-a52eb592b770,candid:PD040200,POPULATION,Children of LGBTQ parents,This is usually members of the family unit 0 to 18 years of age who are currently being raised by same-sex or LGBT parents. This term could in some circumstances also refer to adult children who were raised by LGBT(Q) parents.,61343652-68ec-468f-aad3-65efd88a213d,,2025-06-04 20:48:18.351649+00,2025-06-04 20:48:18.351649+00,
55eb67ed-2c54-4cf2-8277-e67a5f11f793,d81c255a-7e12-436a-bb52-a52eb592b770,candid:PJ090000,POPULATION,Emergency responders,"Uniformed personnel who are a first line of defense and response in emergencies like crimes, accidents, and disasters, such as police, firefighters, EMTs, and others.",212fc437-660e-4f33-9c3b-08d97ba29ba8,,2025-06-04 20:48:18.351649+00,2025-06-04 20:48:18.351649+00,
56559d27-5e66-49e4-b02a-70e6dab815e2,f1bfbae2-3b2f-42b8-8b02-747ee1504399,SJ020000,focusArea,Abuse prevention and services,"Attempts to prevent and eliminate personal abuse, including abuse of children, spouses, intimate partners, older adults, people with disabilities, students, or prisoners, whether this abuse occurs in the home, school, residential care, other protected settings, or elsewhere. Includes efforts to deal globally with the prevention of violence, abuse, and neglect in protected settings and elsewhere. For family violence shelters and services, use Domestic violence shelters. See also: Sexual assault victim services (in Health) and Victim aid (in Human services).",66a3640a-1c09-470a-8b6c-d756082611c9,,2025-07-16 13:03:31.072312+00,2025-07-16 13:03:31.072312+00,
56c6e7cc-cc9b-4b48-aa93-16bf2da3b9ad,f1bfbae2-3b2f-42b8-8b02-747ee1504399,SC010000,focusArea,Environmental justice,"Activities seeking to ensure the fair distribution of benefits, hazards and burdens related to the environment among all peoples and communities regardless of wealth, ethnicity or geographical location, especially in relation to industrial emissions or accidents, agricultural activities, land use and planning, and weather events with deleterious effects on the quality and availability of water, air, soil, food, wildlife and other natural resources. Also the study, theoretical and applied, of these issues. See also: Environmental health.",d1dd1da5-e8cd-4d8d-8c3e-d1d0dfb46496,,2025-07-16 13:03:31.072312+00,2025-07-16 13:03:31.072312+00,
56d03ce3-e6d9-4991-a8ec-70412e618f97,d81c255a-7e12-436a-bb52-a52eb592b770,candid:PJ130000,POPULATION,Farm workers,"People employed for labor in agriculture, often on a seasonal basis. For people who own their farm, use Farmers. See also: Migrant workers.",212fc437-660e-4f33-9c3b-08d97ba29ba8,,2025-06-04 20:48:18.351649+00,2025-06-04 20:48:18.351649+00,
56d05647-bae9-423e-98ba-691e1debcae6,d81c255a-7e12-436a-bb52-a52eb592b770,candid:PC010000,POPULATION,LGBTQIA+ people,"People who identify as lesbian, gay, bisexual, transgender, queer, questioning, intersex, asexual, pansexual or two-spirit, as well as other individuals with related identities. This umbrella term groups all individuals who do not identify as heterosexual or cisgender.",8d604373-cb3e-440b-aace-20b662e81962,,2025-06-04 20:48:18.351649+00,2025-06-04 20:48:18.351649+00,
572c3c25-0553-46f6-8930-6fdd4d0dadfe,ad45a607-0d5d-4c9e-83c7-4ad9a44f3d81,necFunding:6,,Program-related investments,,,,2025-05-18 18:46:03.203687+00,2025-05-18 18:46:03.203687+00,
57def2fc-8787-43cc-b869-3e46fd6f82d7,ad45a607-0d5d-4c9e-83c7-4ad9a44f3d81,necFunding:1,,Grant,,,,2025-05-18 18:46:01.465674+00,2025-05-18 18:46:01.465674+00,
5819a8f8-abf0-4ffc-91de-a7d8b7df9a90,f1bfbae2-3b2f-42b8-8b02-747ee1504399,necSimple:energyAndUtilities,focusArea,Energy & Utilities,,,,2025-05-19 12:21:36.965564+00,2025-05-19 12:21:36.965564+00,
58c12be1-1c8e-4ec1-abb8-a23a7fd93ca0,d81c255a-7e12-436a-bb52-a52eb592b770,candid:PA000000,POPULATION,Age groups,"People categorized by age. The age ranges provided are the ones considered by Candid to be fairly common and sensible ranges associated with each term, but other organizations associate quite different ranges with some of the terms.",,,2025-06-04 20:48:18.351649+00,2025-06-04 20:48:18.351649+00,
5919c2ab-be9e-48af-9e81-67758223453a,f1bfbae2-3b2f-42b8-8b02-747ee1504399,SG000000,focusArea,Social sciences,"The study of, teaching of, or research in one or more of, the social sciences, including economics, psychology, political science and demographics. Also includes interdisciplinary research programs such as black studies and urban studies.",,,2025-07-16 13:03:31.072312+00,2025-07-16 13:03:31.072312+00,
5a0eecf9-b609-4aaa-8f3f-3bcb83f3045a,d81c255a-7e12-436a-bb52-a52eb592b770,candid:PG070000,POPULATION,Out-of-home youth,"Young people, usually adolescents, who are living in foster care, in juvenile justice centers, homeless shelters, or on the streets.",0a8754d2-78da-4098-8841-61a78e986e86,,2025-06-04 20:48:18.351649+00,2025-06-04 20:48:18.351649+00,
5b26eaa1-089b-4329-8206-75b7e0ffda70,ad45a607-0d5d-4c9e-83c7-4ad9a44f3d81,necFunding:7,,Federal grant,,,,2025-05-18 18:46:03.527468+00,2025-05-18 18:46:03.527468+00,
5b777d8c-935b-4838-b58d-0fa64503ecbc,f1bfbae2-3b2f-42b8-8b02-747ee1504399,SB010000,focusArea,Equal opportunity in education,"Provision of programs or policy initiatives intended to insure equal access to educational opportunities regardless of potential barriers such as race, ethnicity, age, ability or disability, gender, religion, social class, citizenship and sexual orientation.",95050dbb-3d92-4cf5-a62c-11916c5af9b9,,2025-07-16 13:03:31.072312+00,2025-07-16 13:03:31.072312+00,
5baa5a1a-3c63-4659-95da-7c3d898a72e0,f1bfbae2-3b2f-42b8-8b02-747ee1504399,SG010000,focusArea,Anthropology,"The systematic study of human beings, their antecedents and related primates, and their cultural behavior and institutions, in comparative perspective. Includes research, teaching or study in the areas of: Biological/physical anthropology; Primatology; Human paleontology and prehistoric archaeology; Hominid evolution; Anthropological linguistics; Ethnography; Ethnology; Ethnohistory; Sociocultural anthropology; Psychological anthropology; Applications to medicine, forensic pathology, museum studies, and international affairs. For anthropology museums, use Natural history museums.",5919c2ab-be9e-48af-9e81-67758223453a,,2025-07-16 13:03:31.072312+00,2025-07-16 13:03:31.072312+00,
5dd334d9-6654-4bf4-bd2a-6f75afc5c711,f1bfbae2-3b2f-42b8-8b02-747ee1504399,SK040000,focusArea,Democracy,"The activities of a political system where citizens choose their government through open elections, citizens are active participants in public life and civic culture, the human rights of all citizens are protected by their government, and citizens are governed by the rule of law. This includes the establishment of democratic institutions in societies which had not formerly had them; the protection of democratic institutions under threat of overthrow or attrition; and the expansion of democratic institutions and principles to new areas of public life. This can also refer specifically to the principles and practices of Liberal democracy which may include constitutional protections of rights such as liberty and equality, promotion of openness and integrity in democratic institutions, and wider and more meaningful participation by all.",cd8ae35a-a7a6-4e31-92f2-eae545653e9b,,2025-07-16 13:03:31.072312+00,2025-07-16 13:03:31.072312+00,
5f5b31d7-7b6f-4ef9-9851-dcdf7ee84c23,f1bfbae2-3b2f-42b8-8b02-747ee1504399,SF040000,focusArea,Biology,"Efforts to support or conduct research in sciences which analyze the structure, function, growth, origin, evolution or distribution of living organisms and their relations to their natural environments. Use this high-level code for organizations that conduct broad research in biology/life sciences or focus on a specific area not broken out at a lower level, e.g., marine biology, biotechnology, biophysics, cell biology, microbiology/bacteriology, toxicology, biological immunology, and virology.",6112e133-fbeb-48b9-82fd-fef339aef9b9,,2025-07-16 13:03:31.072312+00,2025-07-16 13:03:31.072312+00,
5fe26ac4-18fd-45c9-a727-3afd33749f72,f1bfbae2-3b2f-42b8-8b02-747ee1504399,SB030000,focusArea,Elementary and secondary education,"Formal education provided by elementary and secondary schools for children and adolescents through a graded system of instruction that focuses initially on basic skills such as reading, writing, and mathematics and later on a broader curriculum of study which prepares students for specific employment opportunities or undergraduate, graduate and/or professional study of specific fields or practices.",95050dbb-3d92-4cf5-a62c-11916c5af9b9,,2025-07-16 13:03:31.072312+00,2025-07-16 13:03:31.072312+00,
6002bcda-3913-4ef0-946c-2bb2bd1da640,f1bfbae2-3b2f-42b8-8b02-747ee1504399,SE010000,focusArea,Health care quality,"Health care quality is receiving the best possible care for an illness or condition including the avoidance of errors/mistakes, patient safety, respectful treatment by health care professionals and clear answers to questions about treatment. Use for: HCQ, Health care improvement. See also: Patient-Centered care.",890b4e78-ed3a-4b30-8075-2a0ae8097499,,2025-07-16 13:03:31.072312+00,2025-07-16 13:03:31.072312+00,
6037c2f2-ef90-495e-aaf8-2b19117c7543,f1bfbae2-3b2f-42b8-8b02-747ee1504399,SK060000,focusArea,National security,"Activities to ensure the success and security of the state and its infrastructure via economic, political, diplomatic, intelligence and other means. This is accomplished in the face of threats from other states, from non-state actors, and from widespread disasters and/or scarcity. Use For: Department of Homeland Security.",cd8ae35a-a7a6-4e31-92f2-eae545653e9b,,2025-07-16 13:03:31.072312+00,2025-07-16 13:03:31.072312+00,
6112e133-fbeb-48b9-82fd-fef339aef9b9,f1bfbae2-3b2f-42b8-8b02-747ee1504399,SF000000,focusArea,Science,"Efforts to promote or conduct research and study in the physical and life sciences, mathematics, engineering and technology. Does not include medical research; or research institutes and services operating in a single major group area. For these organizations and programs, use the most appropriate subject code, and a research code from either the Organization Type or Support Strategy facets",,,2025-07-16 13:03:31.072312+00,2025-07-16 13:03:31.072312+00,
61343652-68ec-468f-aad3-65efd88a213d,d81c255a-7e12-436a-bb52-a52eb592b770,candid:PD000000,POPULATION,Family relationships,"The roles and relationships between members of birth, adoptive, transitional, and chosen families.",,,2025-06-04 20:48:18.351649+00,2025-06-04 20:48:18.351649+00,
61f61997-23ac-48e5-9bed-813f48953f40,f1bfbae2-3b2f-42b8-8b02-747ee1504399,SM060000,focusArea,Food waste,"Efforts to reduce food waste, including from manufacturers, retailers, restaurants, and homes. Includes prevention of food waste through enhanced product management and utilization by manufacturers; food rescue and redistribution efforts; and enhanced food recycling.",fb3c0175-ebc9-4f6e-85e0-64092e7bb139,,2025-07-16 13:03:31.072312+00,2025-07-16 13:03:31.072312+00,
6356989a-1b73-4e10-8f54-3927d84c7a62,f1bfbae2-3b2f-42b8-8b02-747ee1504399,SM030000,focusArea,Forestry,Silviculture and resource management such as logging and slash and burn toward the harvesting and agricultural use of forests. Use For: timber production. See also: Forest preservation.,fb3c0175-ebc9-4f6e-85e0-64092e7bb139,,2025-07-16 13:03:31.072312+00,2025-07-16 13:03:31.072312+00,
640500fd-dedb-444b-a343-b6d1461b8aa7,f1bfbae2-3b2f-42b8-8b02-747ee1504399,SB040000,focusArea,Vocational education,"Secondary or postsecondary education programs available in regular or trade high schools or through separate vocational centers or programs that provide formal preparation for semiskilled, skilled, technical or professional occupations for high-school-aged students and, in some cases, adults who have opted to develop or expand their employment opportunities, often in lieu of preparing for college entry. Vocational education programs help participants prepare for full-time employment upon graduation, part-time employment while in school or for more advanced vocational training at the postsecondary level. Includes regional occupational centers and programs and vocational centers (which are generally operated by community adult schools or other secondary or postsecondary institutions). See also: Job training.",95050dbb-3d92-4cf5-a62c-11916c5af9b9,,2025-07-16 13:03:31.072312+00,2025-07-16 13:03:31.072312+00,
66a3640a-1c09-470a-8b6c-d756082611c9,f1bfbae2-3b2f-42b8-8b02-747ee1504399,SJ000000,focusArea,Public safety and disaster management,"Protection and relief of the public from crime, violence, disaster, accident, and other potential causes of harm. Included are crime, abuse, and violence prevention services; police and other law enforcement agencies; detention and rehabilitation services for incarcerated and formerly incarcerated people; judicial and administration of justice activities; legal assistance to individuals and organizations, including groups whose primary purpose is to conduct public interest litigation; activities to prevent, predict or control the effects of disasters; educate and prepare individuals to cope with the effects of disasters; provide broad-based disaster relief services to victims; provide relief to victims of accidents caused by human frailty or error (e.g., poisoning, choking, electrical shock, falls); first aid training and services; and many kinds of safety education and promotion. Does not include agencies that provide aftercare services to the victims of crime or abuse and neglect (see Victim services, Domestic violence, Sexual assault victim services, and other terms).",,,2025-07-16 13:03:31.072312+00,2025-07-16 13:03:31.072312+00,
69e08ec0-eec2-4eba-a3c4-f733495b9d11,f1bfbae2-3b2f-42b8-8b02-747ee1504399,SH050000,focusArea,Information communications technology,"Study, development, and use of the constantly developing, interconnected mass of technologies that provide the means of creating, transmitting and receiving, storing and using information, including telecommunications and computer systems. ICT systems can be very large, as in national infrastructures; smaller, as in community wifi services or business networks; or quite small, as individual pieces of hardware or software. This term may include studies of this technology or the social and economic ramifications of these systems. See also: Technology, Computer science.",6c1cb748-c0c4-4c41-9eb7-8a5d3206991f,,2025-07-16 13:03:31.072312+00,2025-07-16 13:03:31.072312+00,
6a883c41-c91a-403d-8d22-163132ff1bfc,f1bfbae2-3b2f-42b8-8b02-747ee1504399,SE120000,focusArea,Mental health care,"Preventive, diagnostic and treatment services in a variety of community and hospital-based settings to help people to achieve, maintain and enhance a state of emotional well-being, personal empowerment and the skills to cope with everyday demands without excessive stress; to prevent or deal with the consequences of addiction; and to address emergencies or crises having to do with mental trauma or severe mental distress. Treatment may include emotional support, introspection and problem-solving assistance utilizing a variety of modalities and approaches, and medication, as needed, for individuals who range from the severely chronically mentally ill to those who are experiencing difficult life transitions or who are having problems in coping with daily living. Use this term for types of mental health care not specifically broken out at lower levels or for multiple types of care within the same program or facility. See also Art and music therapy. Examples include: Different types of therapies (dance, hypnotherapy, music, orthomolecular, play, poetry, recreation); Psychiatric occupational therapy; Psychiatric rehabilitation; Programs that feature a particular counseling approach (gestalt, Jungian); Supportive services for institutionalized individuals, e.g., pet visitation programs; Psychiatric day treatment; Mental health drop-in centers; Home-based psychiatric care; Community mental health education; Early intervention programs; Mental health evaluation; Psychiatric case management; Psychiatric central intake/assessment; Psychopharmacology/medication monitoring; and Therapist referrals. Also included are efforts to promote social conditions that enhance the potential in the community for good mental health and to improve methods and facilities for treating mental illness.",890b4e78-ed3a-4b30-8075-2a0ae8097499,,2025-07-16 13:03:31.072312+00,2025-07-16 13:03:31.072312+00,
6bbb1097-7fea-4cad-b1f5-0bd163ee8ba6,f1bfbae2-3b2f-42b8-8b02-747ee1504399,SG090000,focusArea,Interdisciplinary studies,"Systematic studies at the intersection of the humanities, physical sciences and social sciences to develop and enhance a broad understanding of particular populations, cultures (e.g., Soviet studies, Chinese studies, etc.) or other related areas of research. Use this term for organizations that conduct broadly conceived interdisciplinary research or for those that address areas of interdisciplinary study not broken out at a lower level.",5919c2ab-be9e-48af-9e81-67758223453a,,2025-07-16 13:03:31.072312+00,2025-07-16 13:03:31.072312+00,
6c1cb748-c0c4-4c41-9eb7-8a5d3206991f,f1bfbae2-3b2f-42b8-8b02-747ee1504399,SH000000,focusArea,Information and communications,"The gathering, storage, organization, manipulation, dissemination, and display of data, information, communication, and narrative. Included are programs that develop or make use of information technology to increase the amount and complexity of data that can be managed; policies that work to insure broad availability of information; programs that gather and broadcast news and information about current events; libraries that store and make available information in a variety of formats; media organizations and programs that broadcast information across a variety of platforms; telecommunications services; and information science and computer applications.",,,2025-07-16 13:03:31.072312+00,2025-07-16 13:03:31.072312+00,
6c7c624e-9a56-48cc-8480-b37116fc2b0b,d81c255a-7e12-436a-bb52-a52eb592b770,candid:PF010000,POPULATION,Christians,People who belong to or worship in a Christian church.,e9f9c588-52c8-4c7d-b4aa-c6c6f38d3201,,2025-06-04 20:48:18.351649+00,2025-06-04 20:48:18.351649+00,
6cde6295-fd96-4a36-8fd5-e377388825dc,f1bfbae2-3b2f-42b8-8b02-747ee1504399,necSimple:artMediaAndTechnology,focusArea,"Art, Media & Technology",,,,2025-05-19 12:21:36.965564+00,2025-05-19 12:21:36.965564+00,
6ce35cae-355c-4a33-bad2-3fc8b3c33c3a,f1bfbae2-3b2f-42b8-8b02-747ee1504399,SE110000,focusArea,Medical support services,"Design and provision of equipment, services or other forms of support which are supplemental to the treatment or rehabilitation of people who have illnesses, injuries or disabilities; or which are instrumental in the prevention of illnesses, injuries or disabilities prior to their occurrence. Use this term for organizations that provide a wide range of health supportive services or which offer services not broken out at a lower level. Included are organizations that provide medical equipment/supplies (e.g., incontinence supplies, medical dressing, apnea monitors, blood pressure monitors, heart monitors, ostomy supplies, respiratory aids, sickroom equipment and therapy beds).",890b4e78-ed3a-4b30-8075-2a0ae8097499,,2025-07-16 13:03:31.072312+00,2025-07-16 13:03:31.072312+00,
6d90b8cb-4c0a-46ca-afa0-4b56a7c90037,d81c255a-7e12-436a-bb52-a52eb592b770,candid:PF080000,POPULATION,Shintos,Adherents of Shinto.,e9f9c588-52c8-4c7d-b4aa-c6c6f38d3201,,2025-06-04 20:48:18.351649+00,2025-06-04 20:48:18.351649+00,
6db2e097-2766-4593-9a90-3dc8f9c1e805,d81c255a-7e12-436a-bb52-a52eb592b770,candid:PF030000,POPULATION,Muslims,Adherents of Islam.,e9f9c588-52c8-4c7d-b4aa-c6c6f38d3201,,2025-06-04 20:48:18.351649+00,2025-06-04 20:48:18.351649+00,
6f5483fe-952c-475e-acdb-c3f4cf1280da,cde31035-40b4-4e5b-963d-49b9e7ddd8d4,splc:AdvocacyAndPolicy,,Advocacy and Policy,"Influencing legislation and government policy, e.g., by lobbying",,,2025-05-01 23:43:14.72712+00,2025-05-01 23:43:14.72712+00,
